,Unnamed: 0,company,description,salary,title,remote,city,state
885,885,Prudential,"Bachelor's degree in computer science, data science, mathematics, or a related field. Work with architecture, data, and design teams to assist with data related…",,Machine Learning Engineer,yes,Remote,
886,886,Spotify,"You should have strong experimentation, metric & data creation, and data visualization skills as well as possess excellent communication skills to interface…",,"Data Scientist, Podcaster Mission",no,New York,NY
887,887,BTAS,"Apply data to develop and provide analytical support to all levels of management. Create, develop, and/or apply existing tools and techniques to conduct data…",,Junior Data Scientist - Future,no,Langley AFB,VA
888,888,Cornerstone,"We are looking for a scrappy, hunter, with a 2-3 years of experience selling data movement, analytics, data science or similar SAAS solutions into mid -market…",,Mid Market Account Executive - AI/ ML / Data science Analytics,yes,Remote,
889,889,TechnoServe,"This will require a deep understanding of data structure, data processing, and software functions to support data flow and interoperability between systems.",,Data Scientist,no,Arlington,VA
890,890,Helm LLC,Prior application of data and reporting integrity and sustainability. Minimum of five years’ experience working with structured and non-structured data to…,,Data Scientist,yes,Remote,
891,891,CBRE,"Familiarity with data science techniques. A master’s degree and in economics, data science, statistics or related, PhD preferred.",,Office Economist,no,Atlanta,GA
892,892,"Scuttlebutt Services, LLC",Generating representative data sets for systems development and data science initiatives. 4+ years of experience designing data models and data warehouses…,"$180,000 - $200,000 a year",Data Engineer,no,Chantilly,VA
893,893,Sendle,Work with business intelligence and data engineering to design and develop data infrastructure to support partnerships evolution and growth.,,"Data Analyst, Partnerships",no,Washington State,
894,894,L3Harris Technologies,Work within a research team to develop creative and innovative interfaces for complex analytical data produced by machine learning and artificial intelligence…,,Artificial Intelligence (AI) Researcher,no,Wright-Patterson AFB,OH
895,895,Pricesenz,"This position develops, tests, and maintains scalable and efficient data pipelines to acquire and transform large volumes of structured and unstructured data,…",,Senior Data Engineer,no,Petersburg,VA
896,896,Applied Information Sciences,"Design scalable data processing and analytics solutions, including Big data storage for various data types and large-scale data processing using Databricks.",,Data Architect,no,Reston,VA
897,897,Webstore Group,Develop custom data models and algorithms to apply to data sets. Assess the effectiveness and accuracy of new data sources and data gathering techniques.,,Data Scientist,no,Tamarac,FL
898,898,Facebook,"Experience manipulating large data sets in SQL or equivalent, and drawing actionable insights from data. We partner closely with several cross-functional teams,…",,"Commerce Enforcement Analyst, Rule Writing",no,Seattle,WA
899,899,Oak Ridge National Laboratory,"We accomplish this mission by conducting fundamental research in quantum computer science, developing and benchmarking quantum algorithms for scientific…",,R&D Associate in Quantum Machine Learning,no,Oak Ridge,TN
900,900,Panasonic Corporation of North America,Experience with visualizing data (e.g. data dashboards). You will work in a small team of data science and algorithm engineers to expand our internal and…,,Data Engineer,no,Palo Alto,CA
901,901,Bossier Parish Community College,"Perform exploratory data analysis and visualization to get a better appreciation of the data. Minimum 3 years work experience in institutional research,…",,Data Analyst Specialist,no,Bossier City,LA
902,902,"Denali System Co., Ltd",Data science: 1 year (Preferred). Proven Experience in working with large scale data systems. Familiar with commonly used data analysis methods and very good…,,"Data Scientist -- Full-time, entry level",no,Mountain View,CA
903,903,Imidex,"BS Degree in data science, engineering, computer science, mathematics or related field with 2 or more years of related experience.","$70,000 - $115,000 a year",Healthcare Research Data Analyst,no,Denver,CO
904,904,Indeed,"Passion to answer Product/Engineering questions with data. Can fish for data: SQL, Pandas, MongoDB. Can do big data modeling work: Hadoop, Pig, Scala, Spark.","$187,000 - $231,000 a year",Senior Data Science Manager - Job Seeker Profile,no,Denver,CO
905,905,University of California San Francisco,Must be interested in enabling health science through working on collaborative data science projects as well as building data science infrastructure and…,,Imaging Data Scientist,no,San Francisco,CA
906,906,Smith Micro Software,"Able to understand various data streams and current methods in data transformation. 2+ years practical experience with data processing, database programming and…",,Data Scientist,no,Pittsburgh,PA
907,907,Indeed,"Curiosity and passion for data and data visualization. 4+ years of relevant experience in a data science, business analytics, business intelligence or…","$89,000 - $118,000 a year","Marketing Analyst, Enterprise Experience",no,Austin,TX
908,908,Facebook,"Regularly manage pipeline activity and maintain data integrity, and proactively share data-centric updates with internal stakeholders.",,"Technical Recruiter, Data Science",yes,Remote,
909,909,ENGAGE Talent,Troubleshoot problems with data and processing. Eagerness to learn new skills and become an expert on the data and data modeling techniques as well as on the…,,Data Analyst /,no,Junior,WV
910,910,PayPal,"Collaborate with external partners, including external credit/banking partners and data vendors. Through a combination of technological innovation and strategic…",,Data Scientist 1,no,Timonium,MD
911,911,SAIC,"Conducts analysis and collaborates with subject matter experts in the planning, design, development, and execution of electronic data processing systems for…",,Data Science Application Administrator,no,Huntsville,AL
912,912,Facebook,Experience learning and applying state-of-the-art practices and methodologies for data disclosure including differential privacy and synthetic data generation.,,"Research Scientist, Statistics (Core Data Science - PhD)",no,Washington,DC
913,913,Microsoft,"Strong Analytics Background, able to pull insightful data to drive decisions and improve product quality and customer experience.",,Supportability Program Manager - Big Data,no,Charlotte,NC
914,914,Facebook,"PhD in a quantitative field such as statistics, physics, computer science or political methodology and 6+ years of relevant experience in data science or…",,"Research Scientist Manager, Ads & Commerce",yes,Remote,
915,915,Emerson,Help to create customer-focused analytics with data scientist peers. Generates reports for decision-making using data visualization tools.,,Data Scientist,no,Sidney,OH
916,916,RCI,Strong data analysis and programming/simulation skills. Statistical data analysis: 3 years (Preferred). Provide statistical support including statistical design…,$50 - $55 an hour,Statistician,no,New Brunswick,NJ
917,917,The Coca-Cola Company,"This job requires experience in analyzing big data using proven statistical tools and techniques, experience with solving data management problems and with…",,Analytics Product Owner - Data Science,no,Atlanta,GA
918,918,"JPMorgan Chase Bank, N.A.","We have unified data and analytics talent across the firm and encompass a variety of disciplines including data science, reporting, quantitative analytics, and…",,JPMWM - CARE - Data Scientist - Associate,no,Jersey City,NJ
919,919,Hiscox,"Create data views and own data quality. This role is a mix of data science, engineering and business analytics. Partner with business to solve problems.",,Data Scientist,no,Atlanta,GA
920,920,ID.me,"Partner with leadership and stakeholders to develop our data science function. In this role, you will work closely with the data team, various operational teams…",,Data Scientist (Remote Eligible),no,Virginia,
921,921,"Wellview, Inc.",Background in data warehouse design (e.g. dimensional modeling) and data mining. Collaborate with the technology team to integrate new data elements and…,,Business Intelligence Analyst,no,Nashville,TN
922,922,Samsara,"4+ years experience as a data analyst, data engineer, or related role. Experience with data visualization, preferably in Tableau.",,Senior Data Analyst,no,California,
923,923,American Credit Acceptance,"Leverage R, Python, SQL, Tableau, and other quantitative analytical techniques to extract and manipulate data, as well as to develop, analyze, validate and…",,Data Scientist,no,Spartanburg,SC
924,924,US Office of Personnel Management,"Analyze difficult statistics and other qualitative/quantitative data, particularly workforce data, FEVS data, survey data, retention, and retirement data.","$72,750 - $94,581 a year",Statistician (Operations and Administration),no,Washington,DC
925,925,Spotify,"Bring our users to the forefront, ensuring data and insights are meaningful, so their needs guide us to the best solutions.",,"Product Insights Manager, Content Platform",no,London,OR
926,926,"LS Technologies, LLC",Provide data driven insights to Senior Management that drive Innovation and a data driven vision for operations. Knowledge of AWS cloud native tools preferred.,,"Data Scientist, Machine Learning",no,Washington,DC
927,927,The Leading Niche,The Expert Statistician must have experience in handling confidential data and in taking all necessary steps to protect personally identifiable information from…,,Statistician Economist,yes,Remote,
928,928,Indeed,"Industry experience in a report development, data science, business analytics, business intelligence or comparable data engineering role, including data…","$113,000 - $145,000 a year","Manager, Business Intelligence",yes,Remote,
929,929,Convoy,Passion for high data quality and scaling/automating data science work. Understand data needs by interfacing with fellow data scientists and business partners.,,Business Intelligence Engineer (All Levels),no,Seattle,WA
930,930,"IntelliGenesis, LLC","Our benefits include: Medical, Dental and Vision Insurance, 25 days of PTO with the option to purchase up to an additional 5 days, 12 paid holidays, up to 10%…",,Language Analyst Talent Community,no,Augusta,GA
931,931,"World Wide Technology, Inc.","We take on the most challenging problems our customers face and provide innovative solutions that can involve data strategy, use cases & analytical modeling,…",,Sr. Analyst - Business and Analytics Advisors,yes,Remote,
932,932,Booz Allen Hamilton,"Ability to pursue a career in data science. Participation in partnerships with data science leaders, like our partnership with NVIDIA to deliver Deep Learning…",,Data Scientist Technical Trainee,no,St. Louis,MO
933,933,Happify Health,"Strong educational background in data science, computer science, or equivalent, including hands-on data science projects and coursework in deep learning,…",,"Data Scientist, AI / NLP",yes,Remote,
934,934,NYC Data Science Academy,An interest in data science. We nurture data science talent and advance student's careers. Friendly staff whom you can learn areas of data science on the side.,,Admissions Associate,no,New York,NY
935,935,"Amazon Web Services, Inc.",Experience developing and managing data science platform and tools. Experience developing and managing data science platform and tools within AWS.,"$119,300 - $160,000 a year","Data Scientist, AWS Training & Certification",yes,Remote,
936,936,NYC Cyber Command,"Developing and maintaining our data pipeline using Apache Beam, Java, Python and other data processing technologies; Expert knowledge in both Java and Python;",,Cyber Associate Data Engineer,no,New York,NY
937,937,DiDi Labs,Research and implement the cutting-edge machine learning algorithms and applications. Analysis on critical real world problems and develop solutions.,,"Machine Learning Engineers & Scientists, Ride-hailing Science",no,Mountain View,CA
938,938,Snark AI,"Familiarity with Machine Learning frameworks (Tensorflow, Pytorch, XGBoost, etc.). Strong Programming Skills (Python, C++, etc.).",,Machine Learning Engineer,no,Menlo Park,CA
939,939,ALSAC/St. Jude Children's Research Hospital,"Bachelor's degree in a quantitative field preferred or significant experience working in data-focused roles including data conversions, data archiving, business…",,Director - Data Science & Insights,no,United States,
940,940,Rhino New York,Create data tools for data science and BI teams to assist them in building and optimizing our product into an innovative industry leader.,,Data Engineer,yes,Remote,
941,941,Netflix,"Utilize internal software applications to source, cleanse and analyze a variety of greenhouse gas and spend data, with a special focus on historical production…",,"Data Analyst, Sustainability",no,Los Angeles,CA
942,942,Allstate,"Development of enterprise data assets, information platforms or data spaces designed for exploring and understanding the data.","$103,000 a year",Lead Data Engineer (Remote/Home-Based Opportunity),no,Northbrook,IL
943,943,Komodo Health,Delivered high-value data analytics projects that our existing data products could not cover. Incorporated a good understanding of the healthcare datasets at…,,Data Scientist,no,New York,NY
944,944,Cognizant Technology Solutions,"Our clients need flexible data structures and a streamlined data architecture that quickly turns data resources into informative, meaningful intelligence.",,Onsite Support Lead (Data Lake),no,Jupiter,FL
945,945,Indeed,"Experience building and/or pulling data using SQL. Work alongside other data scientists and software engineers to expand Indeed's catalog of tools, techniques,…","$138,000 - $174,000 a year",Staff Product Scientist - Candidate Delivery,yes,Remote,
946,946,Cedar Inc,"Cedar is a patient payment and engagement platform that leverages data science, consumer-centric design and technology to improve the healthcare experience for…",,Data Scientist (Product Analyst),no,New York,NY
947,947,General Dynamics Information Technology,"2 years experience analyzing health-related data, specifically in SAS. Communicating with data managers, study personnel, and other clients regarding…",,Statistician (SAS),no,Aberdeen Proving Ground,MD
948,948,LivePerson,Develop and implement effective and reasonable policies and practices to secure protected and sensitive data and ensure information security and compliance with…,,"Governance, Risk and Compliance(GRC) Analyst",no,Washington State,
949,949,Barbaricum,"Specifically, Data Scientists will apply data science expertise in support of Measures of Performance/Measures of Effectiveness (MOP/E) methodology, media…",,Data Scientist,no,McLean,VA
950,950,2nd Order Solutions,Training and development opportunities at cutting edge data-science conferences across the country. Our business analysts use data-driven analytics to provide…,,Business Analyst,no,Glen Allen,VA
951,951,IOMAXIS,"The ideal candidate will have a strong knowledge of ML, NLP, deep learning, knowledge graphs, and the ability to architect solutions; from data collection to…",,AI/ML Engineer,yes,Remote,
952,952,Percheron LLC,"1+ years of blockchain experience in data science or research. Background in engineering, computer science, or economics.",,Crypto Asset Protocol Analyst,yes,Remote,
953,953,Credit Karma,5+ years of experience in managing data science teams. Build a strategic roadmap for data science model development in Trust & Safety.,,"Director, Data Science Trust & Safety",no,Oakland,CA
954,954,Booz Allen Hamilton,"Experience with building complex data pipelines. You’ll design and implement machine learning solutions for complex tasks on large data sets, including…",,Machine Learning Researcher,no,Annapolis Junction,MD
955,955,Spotify,"You have at least 7+ years of overall experience in the user research, data analytics, or data science. Manage a team of user researchers and data scientists.",,"Product Insights Manager, Ad Experience",no,New York,NY
956,956,Tesla,"Own the data annotation pipeline, ensuring quality of data annotation for the entire team. Commitment to data accuracy and throughput.",,Data Annotation Supervisor,no,Buffalo,NY
957,957,FalconsUs,"ML apps Strong computer science fundamentals including knowledge of data structures and algorithms, computational complexity, and object oriented/functional…","$68,000 - $119,000 a year",Machine Learning Engineer,no,Alpharetta,GA
958,958,Jet Edge,Participate in regular market research; review and analyze market data and trends to triangulate aircraft market values and maintain aircraft values database.,,Aviation Research Analyst,no,Columbus,OH
959,959,Everytown for Gun Safety,"The Data Scientist will be a key data resource for the research department, responsible for advanced data analysis, data infrastructure and management, and…",,Data Scientist,no,New York,NY
960,960,Facebook,"You should have a background in a quantitative or technical field, experience working with large data sets, and experience in data-driven decision making.",,Data Scientist - Business Interfaces,yes,Remote,
961,961,Bristol Myers Squibb,"They will have the opportunity to work on complex data science problems including modeling techniques to interpret, infer and recommend based on insights from…",,"Associate Director, Data Science",no,Princeton,NJ
962,962,Mandolin,You should be an experienced data engineer and data wrangler who enjoys optimizing data systems and building them from the ground up.,,Data Engineer (All Levels),no,Indiana,
963,963,Microsoft,"Microsoft aspires to help our customers achieve their own digital transformation, leveraging the power of Microsoft Cloud solutions and support offerings.",,"Manager, Cloud Solution Architects - Data & AI",no,Alpharetta,GA
964,964,Overjet,"An ideal candidate for us is driven to thoroughly understand the data in our domain, developing data quality measures, and driving our product offerings via…",,Data Analyst,no,Boston,MA
965,965,WarnerMedia,"Leads the data analytics and engineering teams in research, development, and implementation of appropriate data systems.",,"Director, Data Analytics & Platform",no,New York,NY
966,966,Microsoft,"We are looking for a Customer Engineer (CE) to contribute to our Customer’s Data & Analytics success by driving adoption, consumption, and support of our…",,"Customer Engineer, Data Analytics",no,Chevy Chase,MD
967,967,Slack,You’ll help define and build a strong data culture at Slack by working cross-functionally with data leadership. Comfort with ambiguity and grace under pressure.,,"Director, Product Analytics and Data Science - Data Science",yes,Remote,
968,968,Reliable Heating & Air,"Do you have experience data management’ providing monthly statistical reporting? Analyzing large data sets, both online and offline: 2 years (Required).","$90,000 - $100,000 a year",Senior Business Visualization Analyst,no,Kennesaw,GA
969,969,Vanderbilt University Medical Center,"Perform and document data analysis, data validation, and data mapping/design. The Tableau Business Intelligence Analyst at the Data and Research Center for the…",,Tableau Business Intelligence Analyst,no,Nashville,TN
970,970,UnitedHealth Group,"Develop learning and optimization plans collaboratively with data science, web analytics, and business stakeholders.",,"Data Analyst - Eden Prairie, MN or Telecommute",no,Eden Prairie,MN
971,971,Zebit,1-3 years of experience in data science and advanced data analytics. Familiar with model and data pipelines. The Associate Data Scientist is responsible for the…,,Associate Data Scientist,yes,Remote,
972,972,Bloomberg,Influence priorities: Review market conventions and data relationships to set rules for data validation. Proficiency using data and statistical modeling and…,,Data Scientist,no,Princeton,NJ
973,973,US National Science Foundation,These programs support research and education that expand the knowledge base of the mathematical and statistical sciences through awards to individual…,"$174,225 - $194,516 a year","Division Director, Division of Mathematical Sciences (DMS)",no,Alexandria,VA
974,974,"Stifel, Nicolaus & Co., Inc.",Experience with data visualization software & dashboard generation. Experience with data visualization software & dashboard generation – Tableau experience…,,FINANCIAL ANALYST - DATA SCIENCE,no,Bethesda,MD
975,975,Cloudmed (Formerly Revint Solutions),Identify gaps in our data collection and collaborate with Sales / Marketing / Finance on data capture specifications. Microsoft Powerpoint: 1 year (Preferred).,"$46,742 - $65,000 a year",Commercial Operations Analyst,yes,Remote,
976,976,Nielsen,"Preferred experience in big data technologies. Must have ability to manipulate, analyze, interpret large data sources, and tell a story from data through…",,Data Scientist,no,Oldsmar,FL
977,977,Verizon,"Skills with analyzing and deconstructing very large data sets. Conduct statistical analysis, 3rd party data integration and hypothesis testing.","$80,600 - $149,800 a year",Data Scientist,no,Denver,CO
978,978,Keurig Dr Pepper,"Support cloud migration of data science services Develop a deep understanding of business data sets Design efficient and standardized data structures, database…",$26.00 - $37.50 an hour,Data Engineering Co-op,no,Burlington,MA
979,979,Microsoft,Experience working with unstructured and structured data with a solid understanding of big data solutions. Work creatively with data engineers to help create…,,Business Intelligence Engineer- Data & Applied Sciences,no,Redmond,WA
980,980,Guidehouse,"Experience with data science, machine learning, and statistics. Identify the relationships among multiple sources and types of information to identify…",$70 an hour,Project Employee (Managing Consultant level) – Global Investigations & Compliance – Technology,no,New York,NY
981,981,Talend,Develop data fingerprinting models to inform users about duplicated and related data. Help users get more value from their data faster with data modeling and…,,Data Scientist,no,Philadelphia,PA
982,982,Kepler Fi,"Build data ETL pipelines, robust machine learning systems to support the quantification of Fundamental investment processes. Buy-Side quant research experience.",,Senior Quant/Machine Learning Researcher (Contract),no,New York,NY
983,983,Occam Solutions,"Build data solutions, tools, and capabilities to enable self-service frameworks for data consumers to monitor and report on data.",,Data Analyst-MARSOC Camp Lejeune NC,no,Camp Lejeune,NC
984,984,2nd Order Solutions,"Training and development opportunities at cutting edge data-science conferences across the country. Their ability to understand, navigate, and manipulate a…",,Data Scientist,no,Glen Allen,VA
985,985,BIOINTELLISENSE INC,"Develop data pre-processing scripts for use in data science pipelines. This engineer will help monitor deployments in the field, analyze data from our various…",,Data Science Support Engineer,yes,Remote,
986,986,Civis Analytics,"Grow Civis' business by delivering excellent work, identifying new strategic growth opportunities for the company, and developing expertise and credibility in…",,"Applied Data Science Lead, Political",no,Washington,DC
987,987,Aaron's,"Proficiency in several areas of data modeling, predictive analytics, statistical modeling & analysis, data engineering and data visualization.",,Data Analyst,no,Atlanta,GA
988,988,Civis Analytics,"Make individual technical contributions to data science projects. Identify possible new data sources for survey weighting, and automate refreshes of existing…",,"Tech Lead, Data Science",no,Illinois,
989,989,HP,Minimum 5+ years experience in digital media analytics and data science role. A successful candidate will lead and develop the data scientists and analysts to…,,Global Head Search and Marketing Returns Analytics,no,Alpharetta,GA
990,990,"Fiserv, Inc.",The QA teams primary testing coverage includes functional and regression testing of our Gateway Services products. Oversee the writing of test cases/scripts.,,Technology Analyst Program - Quality Assurance Testing,no,Alpharetta,GA
991,991,Institute of Neuro Innovation,"Education: Undergraduate (minimum), Graduate (preferred), degree in mathematics, data science, biostatistics preferred. Patient recruitment and follow-up.",$26 - $50 an hour,Research Assistant/Data Analyst,no,Santa Monica,CA
992,992,GalaxE.Solutions,Use gathered data to analyze test results and trends. Experienced Data quality analysis to interpret data and analyze the results.,,Data QA Analyst,no,Whippany,NJ
993,993,Adidas,Contributes to exploration and experimentation in data visualization. Applies standard methods to collect and analyze quantitative and qualitative data.,,Senior Manager Data Science,no,Portland,OR
994,994,Pfizer,Working knowledge of clinical data and relevant data standards. Clinical trials expertise with an understanding of data operations required for the reporting of…,"$70,700 - $117,900 a year",Senior Statistical Programmer (Sr. Associate),no,Collegeville,PA
995,995,Institute for Accountable Care,Experience working with health care claims data with Medicare data experience preferred. Statistical programming in SAS and related applications using a variety…,"$90,000 - $130,000 a year",Healthcare Analyst/Statistical Programmer,yes,Remote,
